{
  "module": "governance",
  "purpose": "Health, budgets, autonomy, portability and repository verification.",
  "public_api": ["aion_core.health.run_all", "aion_core.metrics.budget_status"],
  "owned_files": ["aion_core/health.py", "aion_core/metrics.py", "aion_core/milestones.py", "aion_core/autonomy.py", "aion_core/portability.py", "aion_core/usage_telemetry.py", "scripts/*.py"],
  "allowed_dependencies": ["business", "execution", "interfaces", "kernel.state", "kernel.tasks", "memory", "skills"],
  "forbidden_dependencies": [],
  "state_touched": ["Health, metrics, budgets and autonomy records in canonical SQLite", "Verification reports"],
  "side_effects": ["Health probes, telemetry reads and report output"],
  "tests": ["tests/test_authority_verifier.py", "tests/test_portability_guard.py", "tests/test_runtime_inventory.py", "tests/test_complexity_map.py", "tests/test_duplication_scan.py", "tests/test_task_context_profiler.py", "tests/test_usage_telemetry.py"],
  "invariants": ["Protected authority and portability gates remain authoritative."],
  "adrs": [],
  "risk_level": "high",
  "protected_paths": ["scripts/verify_authority.py", "scripts/ci_health_gate.py", "scripts/check_portability.py"]
}
